{
    "required_status_checks": {
        "strict": true,
        "contexts": [
            "build-and-deploy"
        ]
    },
    "enforce_admins": true,
    "required_pull_request_reviews": {
        "dismissal_restrictions": {
            "users": [
                "yuhattor"
            ],
            "teams": [],
            "apps": []
        },
        "dismiss_stale_reviews": true,
        "require_code_owner_reviews": true,
        "required_approving_review_count": 2
    },
    "restrictions": {
        "users": [
            "yuhattor"
        ],
        "teams": [],
        "apps": []
    },
    "required_linear_history": true,
    "allow_force_pushes": true,
    "allow_deletions": true
}